{
  "scenario_version": "1.2",
  "scenario_id": "PAIRWISE-MCP-ROLE-BOUND-CROSS-CONSUMPTION-02",
  "target_id": "AICP-BASE@0.1+BIND-MCP@0.1",
  "message_flow": [
    "CONTRACT_PROPOSE",
    "CONTRACT_ACCEPT",
    "ATTEST_ACTION"
  ],
  "transport_roles": [
    "client",
    "server"
  ],
  "mcp_flow": [
    "producer_client_send_to_consumer_server",
    "consumer_client_poll_consumer_server",
    "consumer_client_send_to_producer_server",
    "producer_client_poll_producer_server",
    "producer_client_send_to_consumer_server",
    "consumer_client_final_poll_consumer_server"
  ],
  "freshness": {
    "run_count": 2,
    "fresh_fields": [
      "run_id",
      "challenge",
      "session_id",
      "contract_id",
      "message_id",
      "jsonrpc_id",
      "process_instance_id",
      "cursor"
    ],
    "semantic_equivalence_required": true
  },
  "challenge_binding": {
    "proposal_contract_goal": "direction.challenge",
    "consumer_discovery": "participant_client_poll_response_only",
    "acceptance_peer_message": "client_consumed_proposal",
    "attestation_peer_message": "client_consumed_acceptance"
  },
  "final_consumption_required": true
}
